{"accepted_refs":[{"id":"blob:f600d5f8f757ec0c810e68a66eac10898d45e0f8cd3b3043e0aaebf2f5cf3627","sha256":"f600d5f8f757ec0c810e68a66eac10898d45e0f8cd3b3043e0aaebf2f5cf3627"},{"id":"blob:cdec5e5d5936baec2545549203d9822067497f4b80db4bf8a9d7c8d055b34d4f","sha256":"cdec5e5d5936baec2545549203d9822067497f4b80db4bf8a9d7c8d055b34d4f"},{"id":"blob:7566499769726faf32d3f836606d67f3e32b107310d2bc1e662587ccfc9dd88a","sha256":"7566499769726faf32d3f836606d67f3e32b107310d2bc1e662587ccfc9dd88a"}],"action":"advance","assessment_ref":{"id":"assessment:a757e9f09288462ba24fa474210e19c3","sha256":"c5a10cae3b1b732add7ea34c135d8405aeb48a62d8ac5db8278464aef1733b0d"},"attempt_id":"benchmark-a1","check_plan_ref":{"id":"blob:e93af8cd612e30c64be761d9d160a948dc2001797f7334564a096cb601819bfc","sha256":"e93af8cd612e30c64be761d9d160a948dc2001797f7334564a096cb601819bfc"},"contract_ref":{"id":"blob:66969bd8fa4f84fe4a3fc7c235bf01d498afc15b2ed7aac60ad47e294228729a","sha256":"66969bd8fa4f84fe4a3fc7c235bf01d498afc15b2ed7aac60ad47e294228729a"},"deterministic_result_ref":{"id":"blob:85fce2deb6bf5b7a0c69b047b55bf496c19d5fc6ae2ef7d3a31f5521f0dd71c3","sha256":"85fce2deb6bf5b7a0c69b047b55bf496c19d5fc6ae2ef7d3a31f5521f0dd71c3"},"id":"gate:1e1debd58284407fb9941073d00a1bd5","input_refs":[{"id":"blob:add14e35bac61eac30061bc035f9796b1d6f58204f87a82898d196f12b1b4f30","sha256":"add14e35bac61eac30061bc035f9796b1d6f58204f87a82898d196f12b1b4f30"},{"id":"blob:4d51b2387bc6bcd0cac9716af7ddea981fc555f1f8a0781641e344aebc1e7d4e","sha256":"4d51b2387bc6bcd0cac9716af7ddea981fc555f1f8a0781641e344aebc1e7d4e"},{"id":"blob:db5c02de133e3dcb25d5bf802e382567a57bf0f5b2cac03b4e8a23eb255bfa99","sha256":"db5c02de133e3dcb25d5bf802e382567a57bf0f5b2cac03b4e8a23eb255bfa99"},{"id":"blob:7d3206f23b6122dd59c8556cc40a10dd0dc6d814a910545ee7a26724643a9292","sha256":"7d3206f23b6122dd59c8556cc40a10dd0dc6d814a910545ee7a26724643a9292"},{"id":"blob:c35310dcaac212c85d422d8f924f0afcb09f11f257420578106c12d9f290c95b","sha256":"c35310dcaac212c85d422d8f924f0afcb09f11f257420578106c12d9f290c95b"},{"id":"blob:6de2507fd32d16ef8341c779ce9104d36811e028c746c0a0f1e958555a405b85","sha256":"6de2507fd32d16ef8341c779ce9104d36811e028c746c0a0f1e958555a405b85"},{"id":"blob:69c30f8f9e627138ecfb453b50ef60e3d2b04a64cb2cf39e928d91acdd988bb8","sha256":"69c30f8f9e627138ecfb453b50ef60e3d2b04a64cb2cf39e928d91acdd988bb8"}],"internal_decision_refs":[{"id":"blob:17561f0137debec3acd70c3a9f7c95f983e1900a7e43b9fea8cea480237c048b","sha256":"17561f0137debec3acd70c3a9f7c95f983e1900a7e43b9fea8cea480237c048b"},{"id":"blob:84b5de201770b838abee87b8b00599de44122755a5b01d73cdfed9ac115edd04","sha256":"84b5de201770b838abee87b8b00599de44122755a5b01d73cdfed9ac115edd04"},{"id":"blob:57a96168158f1c6b544f2c15868da004e4a1d39036f8c4adf568a59c386c8eac","sha256":"57a96168158f1c6b544f2c15868da004e4a1d39036f8c4adf568a59c386c8eac"}],"invocation_refs":[{"id":"blob:0155678a8af5c7563464b06c1f8b45e3cae6ab1c674cab42910ba15574fd4b1c","sha256":"0155678a8af5c7563464b06c1f8b45e3cae6ab1c674cab42910ba15574fd4b1c"},{"id":"blob:96daf8eee38e6f886576873f712ad3e29bd4574082950edd08ca79177ae9f9c2","sha256":"96daf8eee38e6f886576873f712ad3e29bd4574082950edd08ca79177ae9f9c2"},{"id":"blob:cd917f32e0984a1624cee0e174b2c3928011b5e107d98581b0d2e2356c21646f","sha256":"cd917f32e0984a1624cee0e174b2c3928011b5e107d98581b0d2e2356c21646f"},{"id":"blob:b9c1ac66b5d4f3f674a65be3e6d1b1608363992b19599c40c0bcf65b68aa1530","sha256":"b9c1ac66b5d4f3f674a65be3e6d1b1608363992b19599c40c0bcf65b68aa1530"}],"node_contract_ref":{"id":"blob:66969bd8fa4f84fe4a3fc7c235bf01d498afc15b2ed7aac60ad47e294228729a","sha256":"66969bd8fa4f84fe4a3fc7c235bf01d498afc15b2ed7aac60ad47e294228729a"},"node_id":"benchmark","output_port":null,"output_refs":[{"id":"blob:f600d5f8f757ec0c810e68a66eac10898d45e0f8cd3b3043e0aaebf2f5cf3627","sha256":"f600d5f8f757ec0c810e68a66eac10898d45e0f8cd3b3043e0aaebf2f5cf3627"},{"id":"blob:cdec5e5d5936baec2545549203d9822067497f4b80db4bf8a9d7c8d055b34d4f","sha256":"cdec5e5d5936baec2545549203d9822067497f4b80db4bf8a9d7c8d055b34d4f"},{"id":"blob:7566499769726faf32d3f836606d67f3e32b107310d2bc1e662587ccfc9dd88a","sha256":"7566499769726faf32d3f836606d67f3e32b107310d2bc1e662587ccfc9dd88a"}],"policy_ref":{"id":"blob:0f26b6a602e638318d3a9d433d280f27f68bf06b664a15338f8f65d19bb32865","sha256":"0f26b6a602e638318d3a9d433d280f27f68bf06b664a15338f8f65d19bb32865"},"reasons":[{"code":"gate_advance","criterion_ids":[],"evidence_refs":[{"id":"blob:85fce2deb6bf5b7a0c69b047b55bf496c19d5fc6ae2ef7d3a31f5521f0dd71c3","sha256":"85fce2deb6bf5b7a0c69b047b55bf496c19d5fc6ae2ef7d3a31f5521f0dd71c3"}],"message":"All mandatory checks and semantic criteria passed"}],"recorded_at":"2026-10-22T02:12:06Z","run_id":"run:7cdedab88098490ca093c1355e84ce1f","schema_version":"2.0.0","scope_kind":"node","subnode_id":null,"verdict":"PASS_WITH_KNOWN_LIMITATIONS"}